{
  "scenarioId": "simple-series",
  "name": "简单串联电路",
  "description": "1 电池 + 1 电阻 + 1 灯泡 串联闭合回路 · Step 1a 演示非空拓扑加载",
  "version": "1.0",
  "initialLayout": {
    "vertices": [
      { "id": "v_bat_l",   "x": 100.0, "y": 200.0, "isTerminal": true  },
      { "id": "v_bat_r",   "x": 220.0, "y": 200.0, "isTerminal": true  },
      { "id": "v_res_l",   "x": 340.0, "y": 200.0, "isTerminal": true  },
      { "id": "v_res_r",   "x": 460.0, "y": 200.0, "isTerminal": true  },
      { "id": "v_bulb_l",  "x": 580.0, "y": 200.0, "isTerminal": true  },
      { "id": "v_bulb_r",  "x": 700.0, "y": 200.0, "isTerminal": true  }
    ],
    "components": [
      {
        "id": "bat_1",
        "type": "battery",
        "x": 160.0, "y": 200.0,
        "value": 10.0,
        "startVertexId": "v_bat_l",
        "endVertexId":   "v_bat_r"
      },
      {
        "id": "res_1",
        "type": "resistor",
        "x": 400.0, "y": 200.0,
        "value": 10.0,
        "startVertexId": "v_res_l",
        "endVertexId":   "v_res_r"
      },
      {
        "id": "bulb_1",
        "type": "lightBulb",
        "x": 640.0, "y": 200.0,
        "value": 10.0,
        "startVertexId": "v_bulb_l",
        "endVertexId":   "v_bulb_r"
      }
    ],
    "wires": [
      {
        "id": "w1",
        "startVertexId": "v_bat_r",
        "endVertexId":   "v_res_l"
      },
      {
        "id": "w2",
        "startVertexId": "v_res_r",
        "endVertexId":   "v_bulb_l"
      },
      {
        "id": "w3",
        "startVertexId": "v_bulb_r",
        "endVertexId":   "v_bat_l",
        "controlPoints": [
          { "x": 760.0, "y": 350.0 },
          { "x":  40.0, "y": 350.0 }
        ]
      }
    ]
  },

  "constraints": [
    {
      "id": "c1",
      "type": "topology",
      "description": "电路必须形成闭合回路",
      "params": { "requireClosed": true },
      "enforced": true
    },
    {
      "id": "c2",
      "type": "componentCount",
      "description": "至少需要一个电池",
      "params": { "componentType": "battery", "minCount": 1 },
      "enforced": false
    }
  ],

  "objectives": {
    "type": "guided",
    "description": "搭建一个简单串联电路，让灯泡发光",
    "successCriteria": [
      {
        "id": "sc-1",
        "type": "circuitClosed",
        "description": "电路形成闭合回路",
        "params": {}
      },
      {
        "id": "sc-2",
        "type": "bulbBrightness",
        "description": "灯泡亮度 > 0",
        "params": { "minBrightness": 0.01 }
      }
    ],
    "hints": [
      { "trigger": "openNodes > 0", "message": "电路还未闭合，请用导线连接所有元件" },
      { "trigger": "no_battery", "message": "请添加一个电池为电路供电" }
    ],
    "validation": { "autoCheck": true, "showFeedback": true }
  }
}
